<?xml version="1.0" encoding="UTF-8"?>
<xs:schema xmlns:xs="http://www.w3.org/2001/XMLSchema">
    <xs:element name="XMLCanciones">
        <xs:complexType>
            <xs:sequence>
                <xs:element name="Cancion" maxOccurs="unbounded">
                    <xs:complexType>
                        <xs:sequence>
                            <xs:element name="Titulo" type="xs:string"/>
                            <xs:element name="Compositores">
                                <xs:complexType>
                                    <xs:sequence>
                                        <xs:element name="Nombre" type="xs:string"/>
                                        <xs:element name="Apellido" type="xs:string"/>
                                    </xs:sequence>
                                </xs:complexType>
                            </xs:element>
                            <xs:element name="Productores">
                                <xs:complexType>
                                    <xs:sequence>
                                        <xs:element name="Nombre" type="xs:string"/>
                                        <xs:element name="Apellido" type="xs:string"/>
                                    </xs:sequence>
                                </xs:complexType>
                            </xs:element>
                            <xs:element name="Sello" type="xs:string"/>
                            <xs:element name="Artista" type="xs:string"/>
                        </xs:sequence>
                        <xs:attribute name="AÃ±o" type="xs:string" use="required"/>
                        <xs:attribute name="Duracion" type="xs:string" use="required"/>
                    </xs:complexType>
                </xs:element>
            </xs:sequence>
        </xs:complexType>
    </xs:element>
</xs:schema>